<?xml version="1.0" encoding="utf-8"?>
<TimeSlots
xmlns:xsi="http://www.w3.org/2001/XMLSchema-instance" 
xsi:noNamespaceSchemaLocation="../schemas/schema-1.xsd" >
    <TimeSlot ID="http://example.org/data/timeslots/MO0800" >
        <TimeSlotBeginning>08:00:00</TimeSlotBeginning>
        <TimeSlotEnd>08:45:00</TimeSlotEnd>
        <DayOfWeek>Monday</DayOfWeek>
        <TakesTime>
            <Lesson ID="http://example.org/data/lessons/MO0800S7">
                <ZoomURI>https://zoom.com/MO0800S7</ZoomURI>
                <Code>MO0800S7</Code>
            </Lesson>
        </TakesTime>
    </TimeSlot>

    <TimeSlot ID="http://example.org/data/timeslots/TH0855" >
        <TimeSlotBeginning>08:55:00</TimeSlotBeginning>
        <TimeSlotEnd>09:40:00</TimeSlotEnd>
        <DayOfWeek>Thursday</DayOfWeek>
        <TakesTime>
            <Lesson ID="http://example.org/data/lessons/TH0855S6">
                <ZoomURI>https://zoom.com/TH0855S6</ZoomURI>
                <Code>TH0855S6</Code>
            </Lesson>
            <Lesson ID="http://example.org/data/lessons/TH0855S7">
                <ZoomURI>https://zoom.com/TH0855S7</ZoomURI>
                <Code>TH0855S7</Code>
            </Lesson>
        </TakesTime>
    </TimeSlot>
    
    <TimeSlot ID="http://example.org/data/timeslots/FR1000" >
        <TimeSlotBeginning>10:00:00</TimeSlotBeginning>
        <TimeSlotEnd>10:45:00</TimeSlotEnd>
        <DayOfWeek>Friday</DayOfWeek>
        <TakesTime>
            <Lesson ID="http://example.org/data/lessons/FR1000S9">
                <ZoomURI>https://zoom.com/FR1000S9</ZoomURI>
                <Code>FR1000S9</Code>
            </Lesson>
            <Lesson ID="http://example.org/data/lessons/FR1000S6">
                <ZoomURI>https://zoom.com/FR1000S6</ZoomURI>
                <Code>FR1000S6</Code>
            </Lesson>
        </TakesTime>
    </TimeSlot>
</TimeSlots>